{"contract":"reasoning-distiller-context-profile/2","profile_id":"context:v2-vector","profile_version":"2","contracts":{"request":"reasoning-distiller-context-pack-request/2","pack":"reasoning-distiller-context-pack/2","result":"reasoning-distiller-context-pack-result/2","failure":"reasoning-distiller-context-pack-failure/1","source_binding":"reasoning-distiller-context-source-binding/1","eligibility":"reasoning-distiller-context-profile-eligibility/1","receipt":"reasoning-distiller-context-pack-receipt/1"},"source_requirements":{"control_slots":[],"operational_evidence_slots":[],"consistency_rules":[]},"knowledge":{"required":true,"canonical_slot_id":"canonical","selector_kinds":["record_id","relation_id"],"empty_result":"reject","snapshot_multiplicity":"single","closure_descriptor":{"contract":"reasoning-distiller-p1c-closure-descriptor-identity-fixture/1","semantic":"pems/2","immutable_snapshot_id":"git-blob:804ff749cd543d7d634492cb90761175f445710b","raw_sha256":"sha256:894763b9af93ded33b9e6ce605c72013ade39c2e6b2927fccfdbeb62eff86381"}},"limits":{"source_resolution":{"max_bindings":4,"max_single_source_bytes":1048576,"max_total_source_bytes":2097152},"projection":{"max_records":100,"max_relations":100,"max_depth":16,"max_bytes":1048576},"canonical_pack":{"max_control_items":4,"max_operational_evidence_items":4,"max_bytes":2097152},"rendering":{"max_activation_bytes":1048576}},"output":{"serializer":"jcs/1","knowledge_encoding":"pems/2"}}